{
  "id": "00000000-0000-4000-8000-000000000007",
  "account_id": "00000000-0000-4000-8000-000000000002",
  "revision": 2,
  "observed_at": "2026-10-04T04:00:00Z",
  "configuration": {
    "name": "Reviewed 800 mm configuration",
    "sensor_width_pixels": 6248,
    "sensor_height_pixels": 4176,
    "pixel_size_um": 3.76,
    "focal_length_mm": 800,
    "binning_x": 1,
    "binning_y": 1,
    "color_state": "mono",
    "filters": [
      {
        "id": "00000000-0000-4000-8000-000000000008",
        "bandpasses": [
          {
            "name": "H-alpha",
            "center_nm": 656.3,
            "width_nm": 3.0
          }
        ]
      }
    ],
    "rotation": "fixed",
    "confirmed_position_angle_degrees": 0,
    "site": {
      "latitude_degrees": 35,
      "longitude_degrees": -115,
      "precision_km": 100,
      "timezone": "America/Los_Angeles"
    }
  }
}
